{"record_count":41,"records_sha256":"6445f6c478f66eeb765f12ff8f1eb031c47dab472ae356393b3b0383df7831ab","result_type_counts":{"classification":1,"computer_assisted_resolution":1,"counterexample":19,"mixed":11,"proof":9},"schema_version":"1.0","source_revision":"8357293486b02dbb2b89c37bf68a4def20068efa","status_counts":{"disproved":19,"partial":10,"proved":11,"statement_defective":1}}
